ticker,company_name,segment,sub_segment
AAC,Ares Acquisition Corporation,shell_companies,
AACT,Ares Acquisition Corporation II,shell_companies,
ACQR,Independence Holdings Corp.,shell_companies,
ACTD,ArcLight Clean Transition Corp. II,shell_companies,
AHAC,Alpha Healthcare Acquisition Corp.,shell_companies,
AHPA,Avista Public Acquisition Corp. II,shell_companies,
ALCC,AltC Acquisition Corp.,shell_companies,
AMHC,Amplitude Healthcare Acquisition Corporation,shell_companies,
AONE,One,shell_companies,
APSG,Apollo Strategic Growth Capital,shell_companies,
APXT,Apex Treasury Corporation Class A,shell_companies,
ATMR,Altimar Acquisition Corp. II,shell_companies,
BCAC,Brookline Capital Acquisition Corp.,shell_companies,
BCTG,BCTG Acquisition Corp.,shell_companies,
BRPM,B. Riley Principal 150 Merger Corp.,shell_companies,
CBAH,"CBRE Acquisition Holdings, Inc.",shell_companies,
CCCX,Churchill Capital Corp X,shell_companies,
CCIV,"Lucid Group, Inc.",shell_companies,
CFVI,CF Acquisition Corp. VI,shell_companies,
CLBR,Colombier Acquisition Corp.,shell_companies,
CLII,Climate Change Crisis Real Impact I Acquisition Corporation,shell_companies,
CMII,CM Life Sciences II Inc.,shell_companies,
CMLT,CM Life Sciences III Inc.,shell_companies,
CNTQ,Chardan NexTech Acquisition 2 Corp.,shell_companies,
CRSA,Crescent Acquisition Corp.,shell_companies,
CTAC,Cerberus Telecom Acquisition Corp.,shell_companies,
CVII,Churchill Capital Corp VII,shell_companies,
CVIIU,Churchill Capital Corp VII Units,shell_companies,
DBDR,Roman DBDR Tech Acquisition Corp.,shell_companies,
DCRD,Decarbonization Plus Acquisition Corporation IV,shell_companies,
DGNR,Dragoneer Growth Opportunities Corp.,shell_companies,
DGNU,Dragoneer Growth Opportunities Corp. III,shell_companies,
DMII,Drugs Made In America Acquisition II Corp. Ordinary Shares,shell_companies,
DMYI,"dMY Technology Group, Inc. III",shell_companies,
DNAA,Social Capital Suvretta Holdings Corp. I,shell_companies,
DNAC,Social Capital Suvretta Holdings Corp. III,shell_companies,
DWAC,Digital World Acquisition Corp.,shell_companies,
ENFA,"890 5th Avenue Partners, Inc.",shell_companies,
ENVI,Environmental Impact Acquisition Corp.,shell_companies,
EOCW,Elliott Opportunity II Corp.,shell_companies,
FAII,Fortress Value Acquisition Corp. II,shell_companies,
FCAX,Fortress Capital Acquisition Corp.,shell_companies,
FGNA,FG New America Acquisition Corp.,shell_companies,
FORE,Foresight Acquisition Corp.,shell_companies,
FPAC,Far Peak Acquisition Corporation,shell_companies,
FRX,Forest Road Acquisition Corp.,shell_companies,
FSII,FS Development Corp. II,shell_companies,
FTIV,Fintech Acquisition Corp. IV,shell_companies,
FWAA,Fifth Wall Acquisition Corp. I,shell_companies,
GHVI,"Gores Holdings VI, Inc.",shell_companies,
GMII,"Gores Metropoulos II, Inc.",shell_companies,
GRSVU,"Gores Holdings V, Inc.",shell_companies,
GSAH,GS Acquisition Holdings Corp II,shell_companies,
GWAC,Good Works Acquisition Corp.,shell_companies,
GXGX,Celularity Inc.,shell_companies,
HERA,FTAC Hera Acquisition Corp.,shell_companies,
HLXA,Helix Acquisition Corp.,shell_companies,
HOL,Holicity Inc.,shell_companies,
HOND,HCM II Acquisition Corp.,shell_companies,
IPVA,InterPrivate II Acquisition Corp.,shell_companies,
ITHX,ITHAX Acquisition Corp.,shell_companies,
IVAN,Ivanhoe Capital Acquisition Corp.,shell_companies,
KVSB,"Nextdoor Holdings, Inc.",shell_companies,
LCY,"Landcadia Holdings III, Inc",shell_companies,
LGAC,Lazard Growth Acquisition Corp. I,shell_companies,
LNFA,L&F Acquisition Corp.,shell_companies,
LOKB,Live Oak Acquisition Corp. II,shell_companies,
LSAQ,LifeSci Acquisition II Corp.,shell_companies,
MACQ,MCAP Acquisition Corporation,shell_companies,
MIT,"Mason Industrial Technology, Inc.",shell_companies,
MOTV,Motive Capital Corp.,shell_companies,
MSDA,MSD Acquisition Corp.,shell_companies,
MUDS,Mudrick Capital Acquisition Corporation II,shell_companies,
NGAC,NextGen Acquisition Corporation,shell_companies,
PACE,TPG Pace Tech Opportunities Corp.,shell_companies,
PACX,Pioneer Merger Corp.,shell_companies,
PDOT,Peridot Acquisition Corp. II,shell_companies,
PONO,Pono Capital Corp.,shell_companies,
PSAC,Property Solutions Acquisition Corp.,shell_companies,
PTIC,PropTech Investment Corporation II,shell_companies,
RAAC,Revolution Acceleration Acquisition Corp,shell_companies,
RACA,Therapeutics Acquisition Corp.,shell_companies,
RONI,Rice Acquisition Corp. II,shell_companies,
ROT,Rotor Acquisition Corp.,shell_companies,
RTP,Reinvent Technology Partners,shell_companies,
RTPY,Reinvent Technology Partners Y,shell_companies,
SAGA,Sagaliam Acquisition Corp.,shell_companies,
SBG,Sandbridge Acquisition Corporation,shell_companies,
SFTW,Osprey Technology Acquisition Corp.,shell_companies,
SNPR,Tortoise Acquisition Corp. II,shell_companies,
SOAC,Sustainable Opportunities Acquisition Corp.,shell_companies,
SPFR,Jaws Spitfire Acquisition Corporation,shell_companies,
SPNV,"Supernova Partners Acquisition Company, Inc.",shell_companies,
SRAC,Stable Road Acquisition Corp.,shell_companies,
SSPK,Silver Spike Acquisition Corp.,shell_companies,
STPC,Star Peak Corp II,shell_companies,
STWO,ACON S2 Acquisition Corp.,shell_companies,
SVFC,SVF Investment Corp. 3,shell_companies,
TCVA,TCV Acquisition Corp.,shell_companies,
THCB,Tuscan Holdings Corp.,shell_companies,
THMA,Thimble Point Acquisition Corp.,shell_companies,
TRAQ,Trine II Acquisition Corp.,shell_companies,
TREB,Trebia Acquisition Corp.,shell_companies,
TVAC,Thayer Ventures Acquisition Corporation,shell_companies,
VACQ,Vector Acquisition Corporation,shell_companies,
VGAC,VG Acquisition Corp.,shell_companies,
VIH,VPC Impact Acquisition Holdings,shell_companies,
VTIQ,VectoIQ Acquisition Corp. II,shell_companies,
WPCB,Warburg Pincus Capital Corporation I-B,shell_companies,
YTPG,TPG Pace Beneficial II Corp.,shell_companies,
ZING,FTAC Zeus Acquisition Corp.,shell_companies,
